"Country","Program","Credit Granting School","Grade System"
"Puerto Rico","Universidad Politecnica de Puerto Rico in San Juan, Puerto Rico (Exchange) (Exchange)","Universidad Politecnica de Puerto Rico","US Grade System"
"Romania","Alexandru Ioan Cuza University in Iasi, Romania (MAUI consortium) (Exchange)","Alexandru Ioan Cuza Univ","Romanian Grade System"
"Russia","Math in Moscow, Russia","Independent University of Moscow","Russian Grade System"
"Russia","School of Russian and Asian Studies - SRAS in Irkutsk, Russia","Irkutsk State University","Russian Grade System"
"Russia","GRINT Centre for Education and Culture in Moscow, Russia","GRINT","US Grade System"
"Russia","School of Russian and Asian Studies - SRAS in Moscow, Russia","Stetson University","US Grade System"
"Russia","School of Russian and Asian Studies - SRAS in St. Peterburg, Russia","Stetson University","US Grade System"
"Singapore","Nanyang Technological University in Singapore City, Singapore (Global E3) (Exchange)","Nanyang Technological University","Singaporian Grade System"
"Slovakia","Comenius University in Bratislava, Slovakia (MAUI consortium) (Exchange)","Comenius University","Slovakian Grade Scale"
"Slovenia","University of Ljubljana in Slovenia (Exchange)","University of Ljubljana","Slovenian Grade Scale"
"Slovenia","University of Ljubljana in Slovenia (MAUI consortium) (Exchange)","University of Ljubljana","Slovenian Grade Scale"
"South Africa","Healthcare Challenges in Cape Town, South Africa sponsored by CFHI","No Credit","No Credit"
"South Africa","IES Abroad South Africa: University of Cape Town","University of Capetown","South African Grade System"
"South Africa","IES Abroad South Africa: Health, Culture, & Development in Cape Town, South Africa","University of Rochester","US Grade System"
"South Africa","IES Abroad South Africa: Summer - Health Studies in Cape Town, South Africa","University of Rochester","US Grade System"
"South Africa","International Internship in Cape Town, South Africa sponsored by IES Abroad","University of Rochester","US Grade System"
"South Korea","Dongseo University (Exchange)","Dongseo University","South Korean Grade System"
"South Korea","Korea University: Korean Language and Electives in English - Summer in Seoul, South Korea sponsored by ISA","Korea University","South Korean Grade System"
"South Korea","Korea University: STEM, Business, Social Sciences and Liberal Arts - Semester/Academic Year in Seoul, South Korea sponsored by ISA","Korea University","South Korean Grade System"
"South Korea","International Internship in Seoul, South Korea sponsored by CRCC Asia","St. Peters University","US Grade System"
"Spain","Europe & The Islamic World sponsored by IAU","IAU","IAU Grades"
"Spain","Mediterranean Ecology sponsored by IAU","IAU","IAU Grades"
"Spain","Psychology of Peace and Conflict in the Mediterranean sponsored by IAU","IAU","IAU Grades"
"Spain","Sports & Society in Europe sponsored by IAU","IAU","IAU Grades"
"Spain","Wine, Gastronomy & Sustainability of the Mediterranean Traveling Seminar sponsored by IAU","IAU","IAU Grades"
"Spain","Wine, Gastronomy & Sustainability of the Mediterranean Traveling Seminar sponsored by IAU","IAU","IAU Grades"
"Spain","Menendez Pelayo International University: International Studies, Business, & Spanish Language - Semester/Academic Year in Seville, Spain sponsored by ISA","Menedez Pelayo International University","Spanish Grade System"
"Spain","Menendez Pelayo International University: Spanish Language, Culture & Business - Summer in Seville, Spain sponsored by ISA","Menedez Pelayo International University","Spanish Grade System"
"Spain","Nebrija University: Spanish Language, Hispanic Studies & Electives - Summer in Madrid, Spain sponsored by ISA","Nebrija University","Spanish Grade System"
"Spain","Nebrija University: Spanish Language, Liberal Arts & Business - Semester/Trimester in Madrid, Spain sponsored by ISA","Nebrija University","Spanish Grade System"
"Spain","Autonomous University of Barcelona in Barcelona, Spain: International Studies, Business & Culture - Semester/Academic Year sponsored by ISA","Universidad Autonomous De Barcelona","Spanish Grade System"
"Spain","Autonomous University of Barcelona in Barcelona, Spain: International Studies, Business & Culture - Summer sponsored by ISA","Universidad Autonomous De Barcelona","Spanish Grade System"
"Spain","Universidad Politécnica de Madrid in Madrid, Spain (Global E3) (Exchange)","Universidad Politecnica de Madrid","Spanish Grade System"
"Spain","Universidad Pontificia Comillas in Madrid, Spain (Exchange)","Universidad Pontifica Comillas","Spanish Grade System"
"Spain","Universidad Pontificia Comillas in Madrid, Spain (Global E3 ) (Exchange)","Universidad Pontifica Comillas","Spanish Grade System"
"Spain","STEM Summer Research in Granada, Spain sponsored by Arcadia University","Arcadia University","US Grade System"
"Spain","International Internship in Barcelona, Spain sponsored by Global Experiences","Fairfield University","US Grade System"
"Spain","International Internship in Madrid, Spain sponsored by API","Nichols College","US Grade System"
"Spain","International Internship in Barcelona, Spain sponsored by CEA","University of New Haven","US Grade System"
"Sri Lanka","IFSA- Intercollegiate Sri Lanka Education (ISLE) Program","Butler University","US Grade System"
"Sweden","Lund University in Lund, Sweden (Global E3) (Exchange)","Lund University","Swedish Grade System"
"Sweden","Stockholm Business School in Stockholm, Sweden (Exchange)","Stocklholm Business School","Swedish Grade System"
"Sweden","Study in Stockholm, Sweden sponsored by DIS","Danish Institute for Study Abroad","US Grade System"
"Switzerland","University of Basel in Basel, Switzerland (MAUI consortium) (Exchange)","University of Basel","Switzerland Grade System"
"Taiwan","National Cheng Kung University in Tainan City, Taiwan (NCKU) Exchange Program (Exchange)","National Cheng Kung University","Taiwainese Grade System"
"Taiwan","National Cheng Kung University in Tainan, Taiwan (NCKU) Summer Program","National Cheng Kung University","Taiwainese Grade System"
"Tanzania","Fundamentals of Wildlife Management in Moyo Hill Camp, Tanzania sponsored by The School for Field Studies","The School for Field Studies","US Grade System"
"Tanzania","Techniques for Wildlife Field Research in Moyo Hill Camp, Tanzania sponsored by The School for Field Studies","The School for Field Studies","US Grade System"
"Tanzania","Wildlife Management Studies in Moyo Hill Camp, Tanzania sponsored by The School for Field Studies","The School for Field Studies","US Grade System"
"Thailand","Mahidol University: Courses with Locals in Multiple Disciplines - Semester/Trimester in Bangkok, Thailand sponsored by ISA","Mahidol University","Mahidol Grade System"
"Turks and Caicos Islands","Applied Marine Research Techniques in South Caicos Island, Turks and Caicos Islands sponsored by The School for Field Studies","The School for Field Studies","US Grade System"
"Turks and Caicos Islands","Marine Resource Studies in South Caicos Island, Turks and Caicos Islands sponsored by The School for Field Studies","The School for Field Studies","US Grade System"
"Turks and Caicos Islands","Tropical Marine Ecosystems: Monitoring and Management in South Caicos Island, Turks and Caicos Islands sponsored by The School for Field Studies","The School for Field Studies","US Grade System"
"Uganda","Community Health Workers and Global Health in Uganda sponsored by CFHI","No Credit","No Credit"
"United Arab Emirates","American University of Sharjah in Sharjah, United Arab Emirates: Graduate Programs sponsored by API","American University of Sharjah","United Arab Emirates System"
"United Arab Emirates","American University of Sharjah in Sharjah, United Arab Emirates: Semester/Academic Year sponsored by API","American University of Sharjah","United Arab Emirates System"
"United Arab Emirates","American University of Sharjah in Sharjah, United Arab Emirates: Summer sponsored by API","American University of Sharjah","United Arab Emirates System"
"United Arab Emirates","Heriot-Watt University in Dubai, United Arab Emirates","Heriot-Watt University","United Kingdom Grade System"
"United Kingdom","Europe & The Islamic World sponsored by IAU","IAU","IAU Grades"
"United Kingdom","Great Cities sponsored by IAU","IAU","IAU Grades"
"United Kingdom","Psychology of Peace and Conflict in the Mediterranean sponsored by IAU","IAU","IAU Grades"
"United Kingdom","Sports & Society in Europe sponsored by IAU","IAU","IAU Grades"
"United Kingdom","Theatre Alive: Theatre in Ireland and England sponsored by IAU","IAU","IAU Grades"
"United Kingdom","Cardiff University (Global E3) (Exchange)","Cardiff University","United Kingdom Grade System"
"United Kingdom","Manchester Metropolitan University in Manchester, United Kingdom (Exchange)","Manchester Metropolitan University","United Kingdom Grade System"
"United Kingdom","Manchester Metropolitan University Summer School in Manchester, United Kindom","Manchester Metropolitan University","United Kingdom Grade System"
"United Kingdom","University of Hull in the United Kingdom (MAUI consortium) (Exchange)","University of Hull","United Kingdom Grade System"
"United Kingdom","University of Manchester in the United Kingdom sponsored by Arcadia University","University of Manchester","United Kingdom Grade System"
"United Kingdom","University of Sheffield in the United Kingdom (Global E3) (Exchange)","University of Sheffield","United Kingdom Grade System"
"United Kingdom","University of Surrey in Guildford, United Kingdom (Exchange)","University of Surrey","United Kingdom Grade System"
"United Kingdom","Parliamentary Internship in Edinburgh, Scotland sponsored by Arcadia University","Arcadia University","US Grade System"
"United Kingdom","STEM Summer Research in Aberdeen, Scotland sponsored by Arcadia University","Arcadia University","US Grade System"
"United Kingdom","STEM Summer Research in Glasgow, Scotland sponsored by Arcadia University","Arcadia University","US Grade System"
"United Kingdom","STEM Summer Research in London, England sponsored by Arcadia University","Arcadia University","US Grade System"
"United Kingdom","University of Sussex: Summer in Brighton, United Kingdom sponsored by IFSA-Butler","Butler University","US Grade System"
"United Kingdom","City, University of London in London, United Kingdom sponsored by Arcadia University","City University London","US Grade System"
"United Kingdom","International Internship in London, United Kingdom sponsored by Global Experiences","Fairfield University","US Grade System"
"United Kingdom","Glasgow School of Art in Glasgow, United Kingdom sponsored by Arcadia University","Arcadia University","US Grade System"
"United Kingdom","International Internship in Bristol, England sponsored by API","Nichols College","US Grade System"
"United Kingdom","International Internship in Edinburgh, Scotland sponsored by API","Nichols College","US Grade System"
"United Kingdom","AIFS Global Education Center in London - Semester","Fairfield University","US Grade System"
"United Kingdom","AIFS Global Education Center in London - Summer","Fairfield University","US Grade System"
"United Kingdom","International Internship in London, England sponsored by CEA","University of New Haven","US Grade System"
"United Kingdom","Heriot-Watt University in Edinburgh, United Kingdom","Heriot-Watt University","United Kingdom Grade System"
"Various Countries","Semester at Sea","Colorado State University","US Grade System"
"Vietnam","International Internship in Ho Chi Minh, Vietnam sponsored by CRCC Asia","St. Peters University","US Grade System"
"Vietnam","Semester in Vietnam - RMIT University Vietnam sponsored by CIS Abroad","RMIT University","Vietnamese Grade System"
"Vietnam","Summer in Vietnam - Photography, Fashion, and Innovation sponsored by CIS Abroad","RMIT University","Vietnamese Grade System"